{
  "version": "website_agent_knowledge_binding_v1",
  "product_id": "product_hk680",
  "product_name": "HK680",
  "product_category": "Servo edge banding machine for panel furniture",
  "target_market": "US",
  "buyer_persona": [
    "Panel furniture manufacturers evaluating servo edge banding equipment",
    "Furniture factory owners seeking automated edge banding with servo precision",
    "Production managers looking for high-precision panel edge banding solutions",
    "Woodworking factories upgrading from manual to servo-controlled edge banding"
  ],
  "features": [
    {
      "name": "Servo-controlled fine trimming, corner rounding, and scraping",
      "status": "ceo_approved",
      "public_use_allowed": true,
      "source": "https://www.syutech.com/hk680-servo-edge-banding-machine-product/"
    },
    {
      "name": "Complete process: spray, milling, gluing, end trimming, fine trimming, corner rounding, scraping, flat scrap, cleaning, buffing",
      "status": "ceo_approved",
      "public_use_allowed": true,
      "source": "https://www.syutech.com/hk680-servo-edge-banding-machine-product/"
    },
    {
      "name": "Computer touch screen with internet remote control, pre-heating, and memory function",
      "status": "ceo_approved",
      "public_use_allowed": true,
      "source": "https://www.syutech.com/hk680-servo-edge-banding-machine-product/"
    },
    {
      "name": "Inovance (Huichuan) PLC + Inverter + Control System",
      "status": "ceo_approved",
      "public_use_allowed": true,
      "source": "https://www.syutech.com/hk680-servo-edge-banding-machine-product/"
    },
    {
      "name": "Independent air storage tank for stable pneumatic supply",
      "status": "ceo_approved",
      "public_use_allowed": true,
      "source": "https://www.syutech.com/hk680-servo-edge-banding-machine-product/"
    },
    {
      "name": "Diamond pre-milling cutter with built-in dust blower",
      "status": "ceo_approved",
      "public_use_allowed": true,
      "source": "https://www.syutech.com/hk680-servo-edge-banding-machine-product/"
    }
  ],
  "specs": [
    {
      "field": "panel_length_min",
      "value": "150 mm (corner trimming: 45x300 mm)",
      "status": "ceo_approved",
      "source": "https://www.syutech.com/hk680-servo-edge-banding-machine-product/"
    },
    {
      "field": "panel_width_min",
      "value": "50 mm",
      "status": "ceo_approved",
      "source": "https://www.syutech.com/hk680-servo-edge-banding-machine-product/"
    },
    {
      "field": "edge_band_width",
      "value": "10-60 mm",
      "status": "ceo_approved",
      "source": "https://www.syutech.com/hk680-servo-edge-banding-machine-product/"
    },
    {
      "field": "edge_band_thickness",
      "value": "0.4-3 mm",
      "status": "ceo_approved",
      "source": "https://www.syutech.com/hk680-servo-edge-banding-machine-product/"
    },
    {
      "field": "feeding_speed",
      "value": "16 / 18 / 22 m/min (3-speed)",
      "status": "ceo_approved",
      "source": "https://www.syutech.com/hk680-servo-edge-banding-machine-product/"
    },
    {
      "field": "installed_power",
      "value": "17.56 kW",
      "status": "ceo_approved",
      "source": "https://www.syutech.com/hk680-servo-edge-banding-machine-product/"
    },
    {
      "field": "air_pressure",
      "value": "0.7-0.9 MPa",
      "status": "ceo_approved",
      "source": "https://www.syutech.com/hk680-servo-edge-banding-machine-product/"
    },
    {
      "field": "machine_size",
      "value": "6700 x 710 x 1628 mm (L x W x H)",
      "status": "ceo_approved",
      "source": "https://www.syutech.com/hk680-servo-edge-banding-machine-product/"
    },
    {
      "field": "machine_weight",
      "value": "2500 kg",
      "status": "ceo_approved",
      "source": "https://www.syutech.com/hk680-servo-edge-banding-machine-product/"
    },
    {
      "field": "voltage",
      "value": "380V/50Hz",
      "status": "ceo_confirmed",
      "source": "CEO confirmed 2026-08-01 (same as HK568)"
    },
    {
      "field": "glue_type",
      "value": "PUR and EVA",
      "status": "ceo_confirmed",
      "source": "CEO confirmed 2026-08-01"
    },
    {
      "field": "warranty",
      "value": "1 year",
      "status": "ceo_confirmed",
      "source": "CEO confirmed 2026-08-01"
    },
    {
      "field": "delivery_time",
      "value": "30 days",
      "status": "ceo_confirmed",
      "source": "CEO confirmed 2026-08-01"
    },
    {
      "field": "applicable_panel_materials",
      "value": "MDF, particleboard, plywood",
      "status": "ceo_confirmed",
      "source": "CEO confirmed 2026-08-01"
    },
    {
      "field": "price_range",
      "value": "NOT for public disclosure",
      "status": "ceo_confidential",
      "source": "CEO confirmed 2026-08-01 (internal only)"
    }
  ],
  "applications": [
    {
      "name": "Panel furniture edge banding (MDF, particleboard, plywood)",
      "status": "ceo_confirmed",
      "public_use_allowed": true,
      "note": "CEO confirmed MDF, particleboard, and plywood are all applicable (2026-08-01)"
    },
    {
      "name": "Servo precision edge banding for high-quality furniture panels",
      "status": "ceo_approved",
      "public_use_allowed": true
    },
    {
      "name": "OEM/ODM customizable edge banding production",
      "status": "ceo_approved",
      "public_use_allowed": true
    }
  ],
  "pain_points": [
    {
      "name": "Standard edge banders lack servo precision for fine trimming and corner rounding",
      "status": "ceo_approved"
    },
    {
      "name": "Factories need remote monitoring and production data tracking capabilities",
      "status": "ceo_approved"
    },
    {
      "name": "Unstable pneumatic supply affects edge banding quality consistency",
      "status": "ceo_approved"
    }
  ],
  "differentiators": [
    {
      "name": "Full servo control on fine trimming, corner rounding, and scraping",
      "status": "ceo_approved",
      "warning": "Do NOT claim industry-unique, absolute first, or quantified advantage."
    },
    {
      "name": "Inovance (Huichuan) control system with internet remote control",
      "status": "ceo_approved",
      "warning": "Do NOT claim superiority over foreign brands without evidence."
    },
    {
      "name": "Independent air storage system for pneumatic stability",
      "status": "ceo_approved"
    }
  ],
  "FAQ": [
    {
      "question": "What is the HK680?",
      "answer": "HK680 is a servo edge banding machine manufactured by Saiyu Technology (SYUTECH). It features servo-controlled fine trimming, corner rounding, and scraping for panel furniture production.",
      "status": "ceo_approved",
      "source": "https://www.syutech.com/hk680-servo-edge-banding-machine-product/"
    },
    {
      "question": "What is the feeding speed of HK680?",
      "answer": "The feeding speed is 16, 18, or 22 m/min (3-speed options).",
      "status": "ceo_approved",
      "source": "https://www.syutech.com/hk680-servo-edge-banding-machine-product/"
    },
    {
      "question": "What is the minimum panel size for HK680?",
      "answer": "Minimum panel length is 150 mm (corner trimming 45x300 mm), and minimum panel width is 50 mm.",
      "status": "ceo_approved",
      "source": "https://www.syutech.com/hk680-servo-edge-banding-machine-product/"
    },
    {
      "question": "What control system does HK680 use?",
      "answer": "HK680 uses Inovance (Huichuan) PLC + Inovance Inverter + Inovance Control System.",
      "status": "ceo_approved",
      "source": "https://www.syutech.com/hk680-servo-edge-banding-machine-product/"
    },
    {
      "question": "What is the installed power of HK680?",
      "answer": "The total installed power is 17.56 kW.",
      "status": "ceo_approved",
      "source": "https://www.syutech.com/hk680-servo-edge-banding-machine-product/"
    },
    {
      "question": "What is the difference between HK680 and HK620?",
      "answer": "HK620 is designed for skeleton door profile edge banding with a profile-oriented process. HK680 is a servo panel edge banding machine with a panel-oriented process. They target different workpiece types.",
      "status": "ceo_approved",
      "source": "https://www.syutech.com/hk680-servo-edge-banding-machine-product/ and knowledge/products/HK620/INDEX.md"
    }
  ],
  "media_requirements": [
    {
      "type": "product_image",
      "status": "missing",
      "impact": "No product images registered in M8A. Official page has images but not yet imported."
    },
    {
      "type": "detail_image",
      "status": "missing",
      "impact": "No detail/component images registered."
    },
    {
      "type": "demo_video",
      "status": "missing",
      "impact": "HK680 promo video (189MB) upload attempted via n8n but encountered ECONNRESET."
    }
  ],
  "internal_links": [
    {
      "label": "HK680 Source Library",
      "path": "knowledge/products/HK680/INDEX.md",
      "status": "available"
    },
    {
      "label": "HK680 Technical Specifications",
      "path": "knowledge/products/HK680/02_Technical_Specifications/hk680_technical_specifications_v1.md",
      "status": "available"
    },
    {
      "label": "HK680 Knowledge Binding V1",
      "path": "knowledge/products/HK680/bindings/website_agent_hk680.knowledge_binding.v1.json",
      "status": "available"
    },
    {
      "label": "HK680 CEO Approval Record",
      "path": "knowledge/products/HK680/10_Review/hk680_public_approval_record_2026-08-01.md",
      "status": "available"
    }
  ],
  "external_references": [
    {
      "label": "Official SYUTECH product page (EN)",
      "url": "https://www.syutech.com/hk680-servo-edge-banding-machine-product/",
      "status": "verified"
    },
    {
      "label": "Official SYUTECH product page (CN)",
      "url": "http://zh.syutech.com/hk680-servo-edge-banding-machine-product",
      "status": "verified"
    },
    {